place_id;Bueno;Malo;Restaurante;latitude;longitude;Reviews;Calificacion
ChIJlTK-eCiaP44R_EBAP6zP_iM;La mayoría de los comensales elogia la calidad de la comida, destacando especialmente las hamburguesas y otros platillos que son considerados deliciosos y bien preparados. Muchos mencionan que el servicio es rápido y amable, lo que contribuye a una experiencia positiva. Además, el ambiente es valorado como acogedor y cómodo, aunque algunos sugieren que podría beneficiarse de una mejor ventilación.;Existen comentarios sobre inconsistencias en el servicio, con algunos clientes reportando atención deficiente y errores en los pedidos. También se menciona que el espacio es algo reducido, lo que puede hacer que el lugar se sienta abarrotado, especialmente en horas pico. Algunos clientes han notado que los precios han aumentado y que las porciones han disminuido, lo que podría ser un factor a considerar al visitar.;El Corral Javeriana;4.6286573;-74.0654668;https://www.google.com/maps/place/?q=place_id:ChIJlTK-eCiaP44R_EBAP6zP_iM;4.833333333333333
ChIJkQCpfiiaP44RzKgT6RU1c7w;Los clientes destacan la excelente relación calidad-precio del restaurante, especialmente en el menú del día, que ofrece platos variados y bien balanceados. La comida es generalmente considerada deliciosa, con una buena sazón y porciones generosas. Además, el ambiente es agradable y acogedor, con un servicio que suele ser rápido y amable, lo que hace que muchos lo recomienden como un buen lugar para desayunar o almorzar.;Algunos comensales han tenido experiencias negativas con el servicio, mencionando demoras significativas en la atención y problemas con la temperatura de los alimentos, como sopas frías. También hay comentarios sobre la inconsistencia en la calidad de la comida, con algunos clientes sintiendo que ha bajado en comparación con visitas anteriores. Además, se sugiere que el restaurante podría mejorar en la limpieza de las mesas y sillas.;Zarzamora;4.6288184;-74.0656281;https://www.google.com/maps/place/?q=place_id:ChIJkQCpfiiaP44RzKgT6RU1c7w;4.6
ChIJsd76eyiaP44RRmmxysDBH9s;Muchos clientes destacan el sabor de las hamburguesas, considerándolas deliciosas y bien preparadas. La atención del personal también recibe elogios, con comentarios sobre la amabilidad y rapidez del servicio en general. Además, el ambiente es valorado positivamente por algunos, quienes lo encuentran cómodo y limpio, ideal para disfrutar de una comida rápida.;Existen quejas sobre la inconsistencia en la calidad de la comida, con algunos clientes mencionando que la carne no es fresca y que los ingredientes no cumplen con las expectativas. El servicio puede ser lento, especialmente en momentos de alta demanda, y hay comentarios sobre la presencia de vendedores ambulantes que afectan la experiencia. También se menciona que los precios son considerados altos en relación con la cantidad de comida servida.;Presto Javeriana;4.6286973;-74.0656965;https://www.google.com/maps/place/?q=place_id:ChIJsd76eyiaP44RRmmxysDBH9s;4.466666666666667
ChIJd93M1yeaP44RUhHR-fWfa40;Los clientes elogian la calidad y el sabor de la comida mexicana, destacando especialmente los burros al pastor y la salsa que los acompaña. Muchos mencionan que el servicio es rápido y amable, lo que contribuye a una experiencia agradable. El ambiente del lugar también recibe comentarios positivos, siendo descrito como limpio y cómodo, ideal para disfrutar en familia o con amigos. Además, los precios son considerados razonables por la mayoría, lo que lo convierte en una opción atractiva para quienes buscan buena comida a un costo accesible.;Algunos comensales han expresado preocupaciones sobre la consistencia en la calidad de los platillos, mencionando que ciertos tacos pueden resultar secos o sin mucho sabor. También hay comentarios sobre la falta de atención al cliente en ocasiones, con experiencias de servicio que no cumplen con las expectativas. Además, se ha señalado que el lugar puede sentirse más como una franquicia de comida rápida que un restaurante tradicional, lo que podría decepcionar a quienes buscan una experiencia más auténtica. Por último, se ha reportado un incidente preocupante relacionado con la higiene que podría afectar la percepción del lugar.;El Carnal - Javeriana;4.6282175;-74.0650642;https://www.google.com/maps/place/?q=place_id:ChIJd93M1yeaP44RUhHR-fWfa40;4.6
ChIJa1Lm7TqbP44R6tGc9ikbMEE;Los clientes destacan la calidad y el sabor de la comida, especialmente los burritos y tacos, que son descritos como frescos y abundantes. El servicio es otro de los puntos fuertes, con meseras amables y atentas que hacen que la experiencia sea aún más agradable. Muchos elogian la relación calidad-precio, considerando que los precios son muy razonables para la calidad de los platillos. Además, el ambiente es acogedor y familiar, lo que contribuye a una experiencia positiva.;Algunos comensales han mencionado que la comida puede tardar un poco en llegar, especialmente en horas pico, por lo que se recomienda ir con tiempo. También hay comentarios sobre la inconsistencia en la frescura de algunas salsas, que podrían mejorar. Aunque la mayoría de las reseñas son muy positivas, hay un par de opiniones que sugieren que la comida podría tener margen de mejora.;El Mero Burrito;4.6291384;-74.0651231;https://www.google.com/maps/place/?q=place_id:ChIJa1Lm7TqbP44R6tGc9ikbMEE;4.933333333333334
ChIJGfaAGiaaP44RyfpYJY-0jfs;Los clientes disfrutan de la calidad y el sabor de las alitas, destacando especialmente las de BBQ y finas hierbas. Muchos elogian el servicio, que es considerado amable y eficiente, y el ambiente del restaurante, que es acogedor y cómodo. La música y la posibilidad de elegir dónde sentarse también son aspectos muy valorados. Además, algunos mencionan que los precios son razonables en comparación con la calidad de la comida.;Existen quejas sobre la inconsistencia en la preparación de las alitas, con algunos clientes reportando que estaban demasiado saladas o mal cocidas. También se han mencionado demoras en el servicio, especialmente en momentos de alta afluencia, y la falta de utensilios adecuados para servir las bebidas. Algunos consideran que los precios son altos en relación con la cantidad de comida servida, lo que podría ser un factor a considerar antes de visitar.;Alitas Colombianas Javeriana;4.629262199999999;-74.0650757;https://www.google.com/maps/place/?q=place_id:ChIJGfaAGiaaP44RyfpYJY-0jfs;4.515151515151516
ChIJ4YrFKyaaP44RqZYyxENMbwg;Los clientes elogian la calidad y el sabor de la comida, destacando especialmente las carnes a la parrilla, los sándwiches y las ensaladas, que son considerados deliciosos y bien preparados. Muchos mencionan la generosidad de las porciones y la buena relación calidad-precio, lo que hace que el lugar sea muy recomendable. Además, el ambiente es descrito como limpio y cómodo, con un servicio generalmente amable y rápido, lo que contribuye a una experiencia agradable.;Algunos comensales han reportado problemas con el servicio, como demoras en la atención y errores en los pedidos, lo que puede afectar la experiencia. También hay comentarios sobre la calidad inconsistente de algunos platillos, como papas fritas frías o sobrecocidas, y la falta de ciertos acompañamientos. Además, el espacio del restaurante es considerado pequeño, lo que puede resultar incómodo en horas pico. Es recomendable verificar los precios finales, ya que algunos clientes mencionan cargos adicionales no informados.;Restaurante CRIOLLO;4.629330299999999;-74.0650739;https://www.google.com/maps/place/?q=place_id:ChIJ4YrFKyaaP44RqZYyxENMbwg;4.666666666666667
ChIJD8JmfCiaP44RsN-a8pdJ_uk;Los clientes disfrutan de la comida casera y deliciosa que ofrece el lugar, destacando la variedad del menú y los precios accesibles. Muchos elogian el excelente servicio y la amabilidad del personal, lo que contribuye a una experiencia agradable. Además, el ambiente es descrito como acogedor y tranquilo, ideal para compartir con amigos o relajarse después de un día de trabajo o estudio.;Algunos comensales han mencionado que el espacio puede ser un poco estrecho, lo que dificulta acomodar a grupos grandes. También hay comentarios sobre la inconsistencia en los pedidos, como recibir un plato diferente al solicitado. Por otro lado, se sugiere mejorar las medidas de bioseguridad, como el uso de tapabocas por parte del personal.;Barra Café;4.6288485;-74.0657477;https://www.google.com/maps/place/?q=place_id:ChIJD8JmfCiaP44RsN-a8pdJ_uk;4.733333333333333
ChIJe6pk7jmbP44RY8MkWeCTI4s;Los clientes disfrutan de la variedad y el sabor de los platos, especialmente el ramen picante y el teokkbokki, que son altamente recomendados. El ambiente del restaurante es otro punto fuerte, con una decoración temática que atrae a los fanáticos del K-pop y crea una experiencia agradable. Además, muchos elogian la atención al cliente, destacando la amabilidad y rapidez del servicio en general.;Existen quejas sobre la inconsistencia en la atención al cliente, con algunos comensales reportando demoras en el servicio y actitudes poco amables por parte del personal. También hay comentarios sobre la calidad de la comida, donde algunos consideran que no cumple con las expectativas, especialmente en comparación con otras sedes. Además, se menciona que las porciones pueden ser pequeñas en relación con el precio, lo que podría ser un factor a considerar al elegir este lugar.;CHOS KOREAN FAST FOOD JAVERIANA;4.6291167;-74.0657574;https://www.google.com/maps/place/?q=place_id:ChIJe6pk7jmbP44RY8MkWeCTI4s;4.477124183006536
ChIJD6l7KM6bP44RkUQS4t4W4II;Los clientes destacan la calidad y el sabor del churrasco, considerándolo uno de los mejores de Bogotá. Muchos elogian la generosidad de las porciones y los precios accesibles, lo que lo convierte en una opción popular para almuerzos. La atención al cliente también recibe buenos comentarios, con menciones sobre el servicio rápido y amable, lo que mejora la experiencia general en el restaurante. Además, los acompañamientos como las papas fritas y el guacamole son frecuentemente recomendados.;Algunos comensales han tenido experiencias negativas con la calidad de la carne, mencionando que en ocasiones llega dura o fría. También hay que tener en cuenta que el servicio puede ser inconsistente, con quejas sobre la atención de ciertos empleados y demoras en la entrega de los pedidos. Además, el ambiente del lugar es descrito como sencillo y, en ocasiones, incómodo, lo que podría afectar la experiencia de los visitantes.;Churrasqueria El Nene;4.628979199999999;-74.065901;https://www.google.com/maps/place/?q=place_id:ChIJD6l7KM6bP44RkUQS4t4W4II;4.666666666666667
ChIJzwmuhyiaP44RKifCe9jrBIk;La mayoría de los comensales elogia la calidad de la comida, destacando especialmente las empanadas y las pizzas, que son consideradas deliciosas y auténticas. Muchos mencionan que los precios son cómodos y accesibles, lo que hace que la experiencia sea aún más atractiva. El ambiente del restaurante también recibe buenos comentarios, siendo descrito como agradable y acogedor. Además, el servicio es valorado positivamente por varios clientes, quienes destacan la amabilidad del personal.;Sin embargo, hay una tendencia preocupante en las reseñas sobre el servicio, con múltiples comentarios que mencionan una atención deficiente y demoras en el servicio. Algunos clientes han tenido experiencias negativas, como problemas con la atención al cliente y situaciones incómodas, como la presencia de un perro en el área de pago. También se han reportado errores en los pedidos y falta de atención a las solicitudes de los comensales, lo que ha llevado a una experiencia insatisfactoria para algunos.;La Monareta;4.629209299999999;-74.0658545;https://www.google.com/maps/place/?q=place_id:ChIJzwmuhyiaP44RKifCe9jrBIk;4.466666666666667
ChIJf72OFLebP44RNzs8OxmDhUs;Los clientes elogian la calidad y el sabor del ramen, destacando que es auténtico y comparable al que se puede encontrar en Japón. Muchos mencionan que los caldos son deliciosos y que los fideos están bien preparados. Además, el ambiente del restaurante es acogedor y limpio, lo que contribuye a una experiencia agradable. El servicio también recibe comentarios positivos, con el personal siendo descrito como amable y atento. Las gyozas y los postres, como el mochi, son otros platos que han sido bien recibidos.;Algunos comensales han tenido experiencias mixtas con ciertos platillos, como el ramen vegetariano, que fue criticado por estar sobrecocido y carecer de sabor. También hay menciones sobre la inconsistencia en la calidad de algunos ingredientes, como el cerdo que fue descrito como grasoso o seco en ocasiones. Además, se ha señalado que el restaurante puede ser pequeño y ruidoso en momentos de alta afluencia, lo que podría afectar la comodidad de la experiencia.;Aizu Ramen Izakaya;4.627519899999999;-74.0657799;https://www.google.com/maps/place/?q=place_id:ChIJf72OFLebP44RNzs8OxmDhUs;4.733333333333333
ChIJDyi4AqKbP44RAnG2IjKmxy4;Los clientes están encantados con la calidad y el sabor de la comida, destacando especialmente los platos brasileños como la moqueca y la feijoada. La atención al cliente es otro punto fuerte, con muchos elogios hacia la amabilidad y el servicio del personal. Además, el ambiente del restaurante es descrito como acogedor y agradable, ideal para compartir con amigos y familiares. Los precios son considerados justos y accesibles, lo que suma a la experiencia positiva.;Aunque la mayoría de las reseñas son muy positivas, hay algunas excepciones que mencionan experiencias negativas, como un mal servicio en un caso aislado. También se ha reportado que en ocasiones los pedidos pueden no estar completos, lo que puede generar frustración. Es recomendable estar atento a la atención durante momentos de alta demanda para asegurar una experiencia óptima.;Cafuné;4.6280113;-74.06613449999999;https://www.google.com/maps/place/?q=place_id:ChIJDyi4AqKbP44RAnG2IjKmxy4;4.933333333333334
ChIJf0o7YSiaP44RpvjsyRs40ns;Los clientes destacan la calidad y el sabor de la comida, especialmente los platos típicos colombianos, que son descritos como deliciosos y abundantes. El ambiente del restaurante es otro punto fuerte, con una decoración acogedora y un diseño atractivo que invita a quedarse. Además, el servicio es generalmente calificado como amable y eficiente, lo que contribuye a una experiencia positiva en general.;Algunos comensales han mencionado problemas con la atención al cliente, especialmente en situaciones de alta demanda, donde el servicio puede volverse lento o poco atento. También hay comentarios sobre la inconsistencia en la preparación de ciertos platos, como los vegetarianos que no cumplen con las expectativas. Por último, se ha reportado que el horario de atención no siempre coincide con lo indicado en Google Maps, lo que puede causar inconvenientes a los visitantes.;De Local;4.627743199999999;-74.0659946;https://www.google.com/maps/place/?q=place_id:ChIJf0o7YSiaP44RpvjsyRs40ns;4.871794871794871
ChIJ404DsembP44Rue6RqPWl-TE;Los clientes elogian la calidad y el sabor de las alitas y las salsas, destacando que son únicas y deliciosas. Muchos mencionan que el servicio es amable y atento, lo que mejora la experiencia general en el restaurante. El ambiente, aunque puede ser mejorado, es considerado agradable por varios comensales. Además, algunos resaltan la buena relación calidad-precio de los platos, especialmente el pollo coreano y las salsas.;Existen quejas recurrentes sobre la inconsistencia en el servicio, especialmente en el manejo de pedidos a domicilio, donde muchos clientes han experimentado largas esperas o problemas con la entrega. También se menciona que el ambiente puede ser insalubre debido a la presencia de palomas y mesas sucias. Algunos clientes consideran que las porciones son pequeñas en relación con el precio, lo que podría ser un punto a mejorar para el restaurante.;Oliva Kim chicken;4.6287211;-74.06623270000001;https://www.google.com/maps/place/?q=place_id:ChIJ404DsembP44Rue6RqPWl-TE;4.333333333333333
ChIJDy2oAyiaP44RxNDXjfJacc4;Los clientes elogian la calidad de la comida, destacando especialmente los crepes y waffles, que son considerados deliciosos y bien preparados. Muchos mencionan que el ambiente es agradable y acogedor, ideal para compartir con amigos y familiares. Además, el servicio es valorado positivamente en varias reseñas, con comentarios sobre la amabilidad del personal y la rapidez en la atención, especialmente en momentos menos concurridos.;Algunos comensales han tenido experiencias negativas con el servicio, mencionando actitudes groseras de ciertos empleados y demoras en la atención durante horas pico. También hay reseñas que indican que el lugar puede estar congestionado, lo que podría afectar la experiencia general. Por otro lado, hay opiniones mixtas sobre la consistencia del servicio, con algunos clientes reportando atención regular en ocasiones.;Crepes & Waffles Centro Comercial Plaza 39;4.626617899999999;-74.0658325;https://www.google.com/maps/place/?q=place_id:ChIJDy2oAyiaP44RxNDXjfJacc4;4.869281045751634
ChIJQ9xEAoiZP44R__CN9PoAM2c;Los clientes disfrutan de la hermosa vista que ofrece el restaurante, especialmente hacia los cerros y el horizonte de Bogotá, lo que crea un ambiente agradable y acogedor. La atención del personal también recibe elogios, destacando su amabilidad y disposición para atender a los comensales. Muchos mencionan que la comida es deliciosa, con una buena variedad de platos y opciones vegetarianas, lo que hace que la experiencia culinaria sea muy satisfactoria.;Sin embargo, hay varias quejas sobre la lentitud del servicio, con tiempos de espera que pueden superar los 30 minutos. Algunos clientes han recibido su comida fría y han notado que ciertos platos no están disponibles. Además, se menciona que los precios son considerados altos en relación con la calidad y el servicio, lo que ha llevado a algunos a buscar alternativas en otros lugares de la universidad.;Restaurante El Mirador;4.6268622;-74.0648132;https://www.google.com/maps/place/?q=place_id:ChIJQ9xEAoiZP44R__CN9PoAM2c;4.8
ChIJ-z5Vpl-aP44RUf8AHmUGik0;Los clientes disfrutan de la calidad y el sabor de las hamburguesas, destacando su frescura y las combinaciones de ingredientes. Muchos elogian la variedad de opciones, incluyendo las hamburguesas vegetarianas, y mencionan que los precios son razonables para la calidad ofrecida. El ambiente, aunque es una plazoleta de comidas, es considerado cómodo y accesible, y varios comensales aprecian la amabilidad del personal.;La atención al cliente ha sido un punto de crítica recurrente, con quejas sobre la falta de un sistema de turnos que cause demoras en la entrega de los pedidos. Algunos clientes han experimentado tiempos de espera prolongados, lo que ha llevado a que la comida llegue fría. También hay comentarios sobre la inconsistencia en la calidad de algunos platillos, como las papas, que en ocasiones no cumplen con las expectativas.;Bozgos Burgers;4.6267796;-74.06604180000001;https://www.google.com/maps/place/?q=place_id:ChIJ-z5Vpl-aP44RUf8AHmUGik0;4.866666666666666
ChIJt-jH2tabP44Ra03yDRbhkOo;Los clientes elogian la calidad y el sabor de las hamburguesas, destacando especialmente la Hamburguesa Miami y la de chicharrón como opciones imperdibles. El servicio también recibe altas calificaciones, con muchos comentarios que resaltan la amabilidad y rapidez del personal. Además, el ambiente es descrito como acogedor y agradable, ideal para disfrutar de una buena comida en compañía de amigos o familiares.;Algunos comensales han tenido experiencias negativas con la calidad de la comida, mencionando hamburguesas frías o mal preparadas, así como problemas con el servicio, como recibir pedidos incorrectos. También hay que considerar que el lugar es pequeño, lo que puede generar esperas en horas pico. Por último, algunos clientes han señalado que los precios pueden ser altos en comparación con la cantidad y calidad de los platillos.;Fronteras Casual Food;4.6277516;-74.0661717;https://www.google.com/maps/place/?q=place_id:ChIJt-jH2tabP44Ra03yDRbhkOo;4.607843137254902
ChIJE1Jk94eZP44RtKRA7LHO2P0;Los clientes destacan la calidad excepcional de las pizzas, describiéndolas como deliciosas y únicas en sabores. La atención al cliente es otro punto fuerte, con muchos comentarios que elogian la amabilidad y el servicio rápido del personal. Además, el ambiente del lugar es muy apreciado, siendo acogedor y con música en vivo que enriquece la experiencia, especialmente los eventos de salsa y jazz. Muchos consideran que es un lugar ideal para disfrutar de un buen café o una comida en un entorno agradable.;Algunos comensales mencionan que el espacio es pequeño, lo que puede hacer que la experiencia sea un poco incómoda en momentos de alta afluencia. También hay comentarios sobre la falta de agilidad en el servicio en ciertas ocasiones. Además, se ha señalado que hay un cargo adicional por el cover cuando hay música en vivo, lo que podría ser una sorpresa para algunos. Por último, algunos clientes sugieren que podría haber más variedad en las bebidas ofrecidas.;Parnaso Café;4.6266219;-74.0662423;https://www.google.com/maps/place/?q=place_id:ChIJE1Jk94eZP44RtKRA7LHO2P0;4.866666666666666
ChIJO6Yi8yiaP44RSOCZSGj7Ous;Muchos clientes destacan la calidad y el sabor de la comida, especialmente los sándwiches, que son considerados deliciosos y frescos. El servicio también recibe elogios, con varios comentarios que mencionan la atención amable y rápida del personal. Además, el ambiente del restaurante es valorado positivamente, siendo descrito como limpio y cómodo, lo que contribuye a una buena experiencia general.;Existen quejas sobre la inconsistencia en la atención al cliente, con algunos usuarios reportando experiencias de servicio grosero o poco cordial. También se menciona que en ocasiones el servicio puede ser lento, lo que puede afectar la experiencia, especialmente en horas pico. Algunos clientes han expresado su descontento con la calidad de ciertos platillos, señalando que no siempre cumplen con las expectativas generadas por la publicidad. Además, hay comentarios sobre precios que algunos consideran altos en relación a la cantidad servida.;Subway;4.629487399999999;-74.0667754;https://www.google.com/maps/place/?q=place_id:ChIJO6Yi8yiaP44RSOCZSGj7Ous;4.6
ChIJJUIsXCiaP44RZJv-p4eobDc;Los clientes suelen destacar la calidad y el sabor de la comida, especialmente la bandeja paisa y la cazuela montañera, que son considerados platos obligados. Muchos elogian el ambiente del restaurante, que es acogedor y tiene un estilo típico paisa, lo que lo convierte en un lugar agradable para disfrutar de una buena comida. Además, varios comensales mencionan la amabilidad y atención del personal como un punto positivo, lo que mejora la experiencia general.;Existen quejas recurrentes sobre la inconsistencia en la calidad de la comida, con algunos platos llegando fríos o mal preparados. También se han reportado problemas con el servicio, incluyendo demoras y actitudes poco amables de algunos meseros. Los precios han sido considerados elevados por algunos clientes, especialmente en relación con las porciones servidas, lo que ha llevado a comentarios sobre la falta de claridad en la facturación. Además, hay preocupaciones sobre la limpieza y la frescura de algunos ingredientes.;Restaurante típico Comedorcito Paisa;4.6286043;-74.06731649999999;https://www.google.com/maps/place/?q=place_id:ChIJJUIsXCiaP44RZJv-p4eobDc;3.8666666666666663
ChIJO7yhXiiaP44RXvdA7xjse7w;Los clientes destacan la calidad excepcional de la comida, especialmente la lasaña y las pastas, que son consideradas entre las mejores de la ciudad. El servicio también recibe elogios constantes por ser amable y eficiente, lo que contribuye a una experiencia agradable. Además, el ambiente del restaurante es descrito como acogedor y perfecto para disfrutar en familia, lo que lo convierte en un lugar muy recomendado para compartir.;Algunos comensales han mencionado que los precios pueden ser un poco altos en relación con las porciones servidas, lo que podría ser un factor a considerar. También hay comentarios sobre la limpieza del lugar, ya que se reportaron mesas sucias en ocasiones. Por último, se sugiere que el aparcamiento puede ser complicado, ya que aunque hay opciones cercanas, puede requerir un poco de caminata.;San Marcos Pastas y Panadería;4.6280247;-74.066966;https://www.google.com/maps/place/?q=place_id:ChIJO7yhXiiaP44RXvdA7xjse7w;5.0
ChIJy7u4lCiaP44RFC6fm8fP-k4;Los clientes elogian el excelente servicio que reciben en el restaurante, destacando la amabilidad y atención del personal. Muchos también mencionan la calidad de la comida, especialmente el pollo y las hamburguesas, que son descritas como deliciosas y bien preparadas. El ambiente es valorado positivamente, siendo considerado limpio y familiar, lo que lo convierte en un buen lugar para disfrutar en compañía.;Algunos comensales han señalado que los precios son altos en relación con las porciones servidas, lo que ha llevado a comparaciones desfavorables con otras opciones en la zona. También hay comentarios sobre la inconsistencia en la calidad de ciertos platillos, como el pollo, que ha sido descrito como salado o en mal estado en ocasiones. Además, se menciona que el ambiente puede verse afectado por la presencia de personas sin hogar en los alrededores, lo que podría generar incomodidad.;Kokoriko;4.6302405;-74.0666572;https://www.google.com/maps/place/?q=place_id:ChIJy7u4lCiaP44RFC6fm8fP-k4;4.738562091503268
