place_id;Bueno;Malo;Restaurante;latitude;longitude;Reviews;Calificacion
ChIJ5T3V6qOZP44RZamx7hBEzkI;Los clientes destacan la calidad y el sabor de la comida, especialmente las pizzas y las hamburguesas, que son consideradas excepcionales. La atención del personal también recibe elogios, siendo descrita como amable y eficiente. Además, el ambiente del restaurante, inspirado en el cine clásico, es muy apreciado, creando un espacio acogedor y entretenido para disfrutar de una buena comida y eventos como el Cine Club.;Algunos comensales han mencionado que el servicio puede ser inconsistente, especialmente en momentos de alta demanda, lo que ha llevado a experiencias de espera prolongadas o errores en los pedidos. También se ha señalado un cargo adicional al pagar con tarjeta, lo que podría ser un inconveniente para algunos. Aunque la mayoría de las reseñas son positivas, hay algunas opiniones que sugieren que la calidad de la comida puede variar en ocasiones.;35mm Gastronomía & Cine;4.624085;-74.07034999999999;https://www.google.com/maps/place/?q=place_id:ChIJ5T3V6qOZP44RZamx7hBEzkI;4.933333333333334
ChIJNf8d3cyZP44RxY3l8E9cayY;Muchos clientes destacan la calidad de los sándwiches, mencionando que son deliciosos y que los ingredientes son frescos. La atención al cliente también recibe elogios, con comentarios sobre la amabilidad y rapidez del servicio. Además, el ambiente del restaurante es descrito como acogedor y limpio, lo que contribuye a una experiencia agradable para disfrutar de una comida ligera o un brunch.;Existen quejas sobre la inconsistencia en la calidad de la comida, con algunos clientes reportando que el pan no estaba fresco y que las porciones de ingredientes eran escasas. También hay menciones de un servicio lento en momentos de alta demanda, lo que puede afectar la experiencia. Algunos usuarios han señalado que el horario de atención es limitado, sugiriendo que sería ideal extenderlo para mayor comodidad.;Subway;4.6229943;-74.0705507;https://www.google.com/maps/place/?q=place_id:ChIJNf8d3cyZP44RxY3l8E9cayY;4.266666666666667
ChIJeXnvx4aZP44RHa9BiIEWLWE;Los clientes destacan la calidad y el sabor de la comida, mencionando que es deliciosa y variada, con especial énfasis en las hamburguesas y los cortes de carne. El servicio también recibe elogios constantes, siendo calificado como excelente y rápido, lo que contribuye a una experiencia agradable. Además, el ambiente del restaurante es descrito como acogedor y familiar, ideal para disfrutar en pareja o con amigos.;Aunque la mayoría de las reseñas son muy positivas, algunos clientes han señalado que ciertos platos pueden no cumplir con las expectativas en cuanto a tamaño o sazón, como el sancocho trifásico, que algunos consideraron insípido. También hay menciones sobre la presentación de los platos, que a veces no coincide con lo que se muestra en el menú. Sin embargo, estas opiniones son menos frecuentes en comparación con los comentarios positivos.;Naranjana;4.6229318;-74.0703096;https://www.google.com/maps/place/?q=place_id:ChIJeXnvx4aZP44RHa9BiIEWLWE;4.937106918238993
ChIJ002OLHyZP44R_7YSzyU44qc;Los clientes elogian la calidad y el sabor de las hamburguesas, destacando su jugosidad y la variedad de opciones, incluyendo la hamburguesa doble y la opción vegetariana. La atención al cliente también recibe muchos halagos, con comentarios sobre el servicio rápido y amable. Además, el ambiente del lugar es descrito como agradable y acogedor, lo que contribuye a una experiencia positiva. Muchos mencionan que los precios son justos, especialmente considerando la calidad de la comida.;Algunos clientes han tenido experiencias negativas con el servicio, mencionando actitudes poco amables de ciertos empleados y demoras en la atención, especialmente en momentos de alta demanda. También hay comentarios sobre la inconsistencia en la cocción de las hamburguesas, lo que puede afectar la experiencia. Además, el espacio del restaurante es considerado pequeño, lo que puede resultar en esperas para conseguir mesa.;LAmBURGUESA;4.623079399999999;-74.0710881;https://www.google.com/maps/place/?q=place_id:ChIJ002OLHyZP44R_7YSzyU44qc;4.8
ChIJs_lenIaZP44RaPr1KkwjrTk;Muchos comensales destacan la calidad de la comida, especialmente los platos de mariscos como el pargo y la cazuela, que son descritos como deliciosos y bien preparados. El servicio también recibe elogios, con varios clientes mencionando la amabilidad y atención de los meseros. Además, el ambiente del restaurante es considerado acogedor y limpio, lo que contribuye a una experiencia agradable.;Sin embargo, hay una tendencia preocupante en las reseñas sobre la inconsistencia en la calidad de la comida. Algunos clientes han reportado platos en mal estado, como pescado descompuesto o mal cocido, lo que ha llevado a experiencias muy negativas. También se menciona que los precios son elevados en relación con las porciones servidas, lo que ha generado quejas sobre la relación costo-beneficio. Además, el servicio puede ser deficiente en momentos de alta demanda, lo que afecta la experiencia general.;Pescadero La Subienda;4.6219819;-74.0690785;https://www.google.com/maps/place/?q=place_id:ChIJs_lenIaZP44RaPr1KkwjrTk;4.4
ChIJ8WHFKQCZP44RAMopHdk4VCk;Los clientes están encantados con la calidad de la comida, especialmente las arepas, que son descritas como deliciosas y con un sabor excepcional. El servicio también recibe elogios constantes, destacando la atención amable y rápida del personal. Además, el ambiente del restaurante es valorado positivamente, siendo considerado un lugar agradable y cómodo para disfrutar de una buena comida.;Aunque la mayoría de las reseñas son muy positivas, hay algunas menciones sobre la inconsistencia en el servicio en momentos de alta demanda, donde algunos clientes notaron un ligero descenso en la atención. También se observan comentarios sobre la necesidad de mejorar ciertos aspectos del ambiente, aunque estos son menos frecuentes.;Arepas AJA;4.6226568;-74.0689728;https://www.google.com/maps/place/?q=place_id:ChIJ8WHFKQCZP44RAMopHdk4VCk;5.0
ChIJl_y5QROZP44RhwVbrB-14WQ;Los clientes destacan la calidad y el sabor de las arepas, así como la variedad de rellenos que ofrecen. Muchos elogian el ambiente acogedor y agradable del lugar, ideal para compartir con amigos y familiares. La atención al cliente también recibe comentarios positivos, con varios usuarios mencionando un servicio amable y eficiente. Además, los precios son considerados razonables, lo que hace que la experiencia sea aún más atractiva.;Algunos comensales han señalado que el tiempo de preparación de los alimentos puede ser mejorado, ya que en ocasiones se sienten un poco lentos. También hay comentarios sobre la calidad de ciertos ingredientes, como la salchicha en el arroz paisa, que no fue del agrado de todos. Por último, algunos clientes consideran que los precios de las bebidas, como la cerveza, son un poco altos en comparación con los platillos.;Arepa Paisa Colombiana 1928;4.6222934;-74.0689203;https://www.google.com/maps/place/?q=place_id:ChIJl_y5QROZP44RhwVbrB-14WQ;4.866666666666666
ChIJl8CChoaZP44RwRSBaY4AyQA;Los clientes disfrutan de la calidad y el sabor de la comida, especialmente el arroz, que es destacado por su buena cantidad y sazón. Muchos elogian el servicio amable y rápido, así como la limpieza del lugar. Además, la relación calidad-precio es considerada excelente, con porciones que rinden para varias personas. El ambiente también recibe comentarios positivos, siendo descrito como agradable y cómodo.;Algunos comensales han experimentado demoras en el servicio, especialmente en momentos de alta demanda. Hay reseñas que mencionan problemas con la consistencia de la comida, como platos quemados o que no coinciden con lo solicitado. También se han reportado inconvenientes con la atención al cliente, como falta de respuesta a pedidos y problemas de limpieza en las mesas. Por último, el aparcamiento puede ser complicado, lo que podría afectar la experiencia general.;Restaurante Kin Wah;4.6222447;-74.0688488;https://www.google.com/maps/place/?q=place_id:ChIJl8CChoaZP44RwRSBaY4AyQA;4.466666666666667
ChIJExF1h4aZP44RXEOv0kAxZHo;Los clientes destacan la calidad y el sabor de la comida, especialmente los platos típicos como el ajiaco, mondongo y sancocho, que son descritos como deliciosos y con un toque casero. Muchos elogian la generosidad de las porciones y los precios accesibles, lo que hace que la experiencia sea muy satisfactoria. Además, el servicio es generalmente calificado como excelente, con un personal amable y atento que contribuye a un ambiente acogedor.;Algunos comensales han mencionado que el ambiente del restaurante podría mejorar, ya que se siente caluroso y las instalaciones no siempre están en las mejores condiciones. También hay comentarios sobre la inconsistencia en el servicio, con experiencias mixtas en cuanto a la rapidez y la atención. Por último, hay quienes consideran que ciertos platos, como el ajiaco, pueden resultar un poco caros en comparación con la cantidad servida.;RESTAURANTE LA CASA DE LAS SOPAS;4.622186399999999;-74.0683884;https://www.google.com/maps/place/?q=place_id:ChIJExF1h4aZP44RXEOv0kAxZHo;4.916666666666667
ChIJaysctoWZP44Rt1-qozyMq28;Muchos clientes destacan la calidad y el sabor de los sándwiches, especialmente las galletas, que son consideradas deliciosas. La atención de algunos empleados ha sido elogiada por ser amable y rápida, lo que mejora la experiencia general. Además, el ambiente del local es valorado positivamente, siendo descrito como limpio y acogedor, ideal para disfrutar de una comida rápida. También se menciona la conveniencia de las opciones vegetarianas y promociones como el 2x1 en ciertos productos.;Sin embargo, hay una tendencia preocupante en las reseñas sobre la atención al cliente, con varios comentarios que mencionan un servicio lento y poco amigable, especialmente en momentos de alta demanda. Algunos clientes han experimentado problemas con la calidad de los ingredientes, señalando que parecen ser de baja calidad o congelados. Además, se ha mencionado que las porciones son pequeñas en relación al precio, lo que puede resultar en una experiencia insatisfactoria.;Subway;4.6203934;-74.06777149999999;https://www.google.com/maps/place/?q=place_id:ChIJaysctoWZP44Rt1-qozyMq28;4.477124183006536
ChIJZY7KBJeZP44RoQ2NOPswMYU;La mayoría de los clientes elogia la calidad de la comida, destacando especialmente el pollo y las alitas, que son descritos como frescos y sabrosos. Muchos también aprecian el ambiente del restaurante, que es considerado agradable y cómodo para disfrutar de una comida. El servicio ha recibido comentarios positivos en varias reseñas, con menciones a la rapidez y amabilidad del personal, lo que contribuye a una buena experiencia general.;Algunos comensales han tenido experiencias negativas con el servicio, mencionando demoras y falta de atención en momentos críticos. También hay que tener precaución con la calidad de los alimentos, ya que se han reportado casos de comida fría o en mal estado, como pollo crudo o productos viejos. Además, se ha señalado que el lugar puede estar sucio en ocasiones, lo que afecta la percepción del ambiente.;KFC Calle 33;4.620721299999999;-74.0676178;https://www.google.com/maps/place/?q=place_id:ChIJZY7KBJeZP44RoQ2NOPswMYU;4.533333333333333
ChIJTeewNYSZP44RBYktTIOSysQ;Los clientes destacan la calidad y el sabor auténtico de la comida árabe, especialmente el plato mixto y el jugo de dátiles, que son considerados excepcionales. La atención personalizada del propietario, Ibrahim, es muy valorada, ya que muchos lo describen como amable y generoso, creando un ambiente acogedor que hace sentir a los comensales como en casa. Además, los precios son considerados razonables para la calidad de los platillos ofrecidos.;Algunos comensales han mencionado que el lugar es pequeño y puede no ser adecuado para grupos grandes, ya que el propietario atiende todo el servicio por sí mismo. También hay comentarios sobre la inconsistencia en la calidad de algunos platillos, como el pollo y el falafel, que pueden resultar un poco secos. Además, se ha reportado que la comunicación telefónica puede ser complicada, ya que solo cuentan con un número fijo que no siempre está disponible.;AL-YAZIRA - COMIDA RAPIDA ARABE;4.6205367;-74.06845899999999;https://www.google.com/maps/place/?q=place_id:ChIJTeewNYSZP44RBYktTIOSysQ;4.8
ChIJW9TkGYGZP44RbX3-mM6MO2c;Los clientes destacan la excelente atención del personal, que es amable y rápido, lo que contribuye a una experiencia agradable en el restaurante. La comida también recibe elogios, especialmente las hamburguesas y el churrasco, que son considerados deliciosos y bien preparados. Además, muchos mencionan que los precios son cómodos y accesibles, lo que hace que este lugar sea una buena opción para quienes buscan comida rápida y sabrosa.;Algunos comensales han notado una desmejora en la calidad de la comida en comparación con visitas anteriores, lo que podría ser un punto a considerar. También hay comentarios sobre la inconsistencia en la preparación de ciertos platillos, como las papas, que en ocasiones llegan en mal estado. Aunque la mayoría de las reseñas son positivas, algunos clientes sugieren que el lugar podría mejorar en la presentación y frescura de algunos ingredientes.;Comidas Rápidas Donde Beto;4.6236977;-74.072935;https://www.google.com/maps/place/?q=place_id:ChIJW9TkGYGZP44RbX3-mM6MO2c;4.743589743589744
ChIJu1ELBIGZP44Rawt4fcdISGI;Los clientes destacan la calidad y el sabor de los panzerottis, considerándolos entre los mejores de Bogotá. La atención al cliente es otro punto fuerte, con muchos comentarios que elogian la amabilidad y rapidez del servicio. Además, el ambiente del local es descrito como limpio y acogedor, lo que contribuye a una experiencia agradable. Muchos también mencionan que los precios son accesibles, lo que hace que la relación calidad-precio sea excelente.;Algunos clientes han reportado demoras en el servicio de domicilios, lo que podría ser un inconveniente si se busca una entrega rápida. También se menciona que el espacio del local es un poco pequeño, lo que podría afectar la comodidad en horas pico. Aunque la mayoría de las reseñas son positivas, es bueno tener en cuenta estas consideraciones al planear una visita.;M.r PANZEROTTI PIZZAS Y OTRAS DELICIAS;4.6239606;-74.0735464;https://www.google.com/maps/place/?q=place_id:ChIJu1ELBIGZP44Rawt4fcdISGI;5.0
ChIJ1WY9BoGZP44R9NQgsbIiVPE;Los clientes disfrutan de las hamburguesas, destacando su sabor, calidad y porciones generosas. Muchos elogian la carne, que es descrita como tierna y bien preparada, y aprecian la variedad en el menú, incluyendo opciones vegetarianas. El ambiente es considerado agradable y tranquilo, ideal para disfrutar de una buena comida. Además, el servicio es valorado positivamente en varias reseñas, con menciones a la amabilidad del personal y la rapidez en la atención.;Existen quejas recurrentes sobre el servicio al cliente, especialmente en el ámbito de las entregas a domicilio, donde se reportan errores, demoras y falta de responsabilidad por parte del personal. Algunos clientes también mencionan que la atención en el local puede ser fría y que la música a veces está demasiado alta, lo que afecta la experiencia. Además, hay comentarios sobre la inconsistencia en la calidad de algunos platillos, como el pan de las hamburguesas y la preparación de otros alimentos.;Hell's Kitchen Bogota Hamburguesería Artesanal;4.623883;-74.07392039999999;https://www.google.com/maps/place/?q=place_id:ChIJ1WY9BoGZP44R9NQgsbIiVPE;4.466666666666667
ChIJiS1gMTGaP44RdN8Tm7LsM64;Los clientes destacan la calidad excepcional de los chocolates y la variedad de productos que ofrece la chocolatería. Muchos elogian el ambiente acogedor y la atención amable del personal, que se muestra conocedor y dispuesto a ayudar. Las recomendaciones de productos, como el chocolate caliente y los bombones, son muy bien recibidas, y muchos consideran que es un lugar ideal para disfrutar de un buen café o un postre. La presentación de los productos también es un punto a favor, siendo perfecta para regalar.;Algunos clientes han tenido experiencias negativas relacionadas con el servicio, mencionando demoras en la atención y problemas con los pedidos, como cobros duplicados o falta de productos disponibles. También hay comentarios sobre que los precios son considerados altos por algunos, lo que podría limitar la frecuencia de las visitas. Es recomendable tener paciencia en momentos de alta demanda y verificar la disponibilidad de productos antes de visitar.;Serge Thiry - Chocolates de Autor - Boutique Park Way;4.6271344;-74.0749663;https://www.google.com/maps/place/?q=place_id:ChIJiS1gMTGaP44RdN8Tm7LsM64;4.666666666666667
ChIJo0_PK-qZP44R1jahNrnBxnk;Los clientes destacan la excelente atención y el ambiente acogedor del lugar, ideal para disfrutar con amigos. La variedad de cervezas importadas y cócteles es muy apreciada, así como la calidad de la comida, especialmente la tabla de quesos y los sándwiches. Muchos elogian la música y el espacio cómodo, lo que contribuye a una experiencia placentera y relajante. La dedicación del personal para ofrecer un servicio personalizado también es un punto muy positivo.;Aunque la mayoría de las reseñas son muy positivas, algunos clientes mencionan que los precios pueden variar, lo que podría ser un factor a considerar al planear una visita. También hay comentarios que sugieren que el lugar puede llenarse, lo que podría afectar la disponibilidad de asientos en horas pico. Sin embargo, esto no parece ser un gran inconveniente para la mayoría de los visitantes.;Jack & Baco;4.6266862;-74.0748933;https://www.google.com/maps/place/?q=place_id:ChIJo0_PK-qZP44R1jahNrnBxnk;5.0
ChIJmyZSnCqaP44RPPTnfI7FlNE;Los clientes disfrutan de un ambiente acogedor y tranquilo, ideal para conversar y relajarse, con buena música que complementa la experiencia. La atención del personal es generalmente calificada como excelente, con un servicio amable y atento. Muchos elogian la calidad de la comida, destacando platos como hamburguesas y hummus, que son bien recibidos por los comensales. Además, el lugar es apreciado por su decoración artística y la posibilidad de disfrutar de música en vivo.;Algunos clientes han mencionado que la oferta de cócteles podría ser más variada y que la carta de comida es a veces considerada básica o con opciones limitadas. También hay comentarios sobre la falta de parqueadero y preocupaciones sobre la seguridad al estacionar en la calle. En ocasiones, se han reportado demoras en el servicio, especialmente en momentos de alta afluencia, lo que podría afectar la experiencia general.;Trementina bar jazz y afines. Café, sandwich y hamburguesas;4.6269783;-74.0749771;https://www.google.com/maps/place/?q=place_id:ChIJmyZSnCqaP44RPPTnfI7FlNE;4.94949494949495
ChIJfXiGmyqaP44ReCje1oiB1IU;Los clientes disfrutan de la calidad y el sabor de las pizzas, destacando que son algunas de las mejores que han probado. Muchos elogian la atención del personal, mencionando que el servicio es amable y eficiente en la mayoría de las ocasiones. El ambiente del restaurante también recibe buenos comentarios, siendo descrito como cómodo y agradable para disfrutar de una comida. Además, los precios son considerados accesibles, lo que hace que la experiencia sea aún más atractiva.;Algunos comensales han experimentado demoras significativas en el servicio, especialmente al momento de recibir sus pedidos. También hay reseñas que mencionan problemas con la calidad de ciertos platillos, como ravioles y pizzas, que han llegado con exceso de aceite o mal preparados. Además, se han reportado incidentes de mal servicio al cliente, lo que ha afectado la experiencia de algunos visitantes. Es recomendable tener paciencia y verificar la calidad de los platos al ordenar.;Aprissa Parkway Pizzeria;4.6272492;-74.0750248;https://www.google.com/maps/place/?q=place_id:ChIJfXiGmyqaP44ReCje1oiB1IU;4.466666666666667
ChIJBUoTEiuaP44R5yfqaVrsOLE;Los clientes disfrutan de la variedad y el sabor de los sándwiches, destacando que son deliciosos y bien preparados. Muchos elogian el ambiente del local, que es considerado acogedor y cómodo para compartir con amigos. Además, hay comentarios positivos sobre la atención al cliente en ciertos momentos, donde el servicio es rápido y amable, lo que contribuye a una buena experiencia general.;Existen múltiples quejas sobre la inconsistencia en el servicio, con menciones de atención al cliente deficiente y actitudes poco amables por parte del personal. Algunos clientes han reportado problemas con la calidad de los productos, como sándwiches fríos o ingredientes no frescos. También se ha señalado la falta de algunos productos en el menú y problemas de seguridad en el local, lo que podría afectar la experiencia de los visitantes.;Subway;4.6278871;-74.0755386;https://www.google.com/maps/place/?q=place_id:ChIJBUoTEiuaP44R5yfqaVrsOLE;4.0
ChIJgbPHkCqaP44RA8VGUHUvD7A;Los clientes destacan la deliciosa comida, especialmente la bandeja paisa y la cazuela de frijoles, que son considerados platos estrella del lugar. La atención al cliente también recibe elogios, con muchos mencionando un servicio amable y rápido. Además, la relación calidad-precio es valorada positivamente, con porciones generosas y un ambiente acogedor que recuerda a las tradiciones paisas.;Algunos comensales han señalado que el restaurante solo acepta pagos en efectivo, lo que puede ser inconveniente. También hay comentarios sobre la inconsistencia en la calidad de algunos platos, con experiencias mixtas en cuanto a la sazón y la frescura de los ingredientes. Además, se menciona que el ambiente puede ser un poco aburrido, ya que no hay música, y que en ocasiones el servicio puede ser lento debido a la alta demanda.;Restaurante Arepas de Medellín;4.6274991;-74.0750846;https://www.google.com/maps/place/?q=place_id:ChIJgbPHkCqaP44RA8VGUHUvD7A;4.712643678160919
ChIJk2B93oubP44RDX4hWDZh_ak;Los clientes destacan la calidad y el sabor de la comida, especialmente los postres y opciones de brunch, con recomendaciones como el tiramisú, torta de chocolate vegana y el fondue de chocolate. El servicio es otro punto fuerte, con muchos elogios hacia la atención amable y eficiente del personal. Además, el ambiente es descrito como acogedor y agradable, ideal para disfrutar de una buena conversación o un momento de tranquilidad.;Algunos comensales han mencionado que el precio puede ser un poco elevado en comparación con la cantidad de comida servida, lo que podría ser un factor a considerar. También hay comentarios sobre experiencias negativas en el servicio al momento de pagar, donde se reportaron problemas con la verificación de billetes. Por último, se sugiere que el restaurante mejore la gestión del tiempo en horas pico para evitar incomodidades.;MAHI Pastelería Para Todos;4.6278481;-74.0749568;https://www.google.com/maps/place/?q=place_id:ChIJk2B93oubP44RDX4hWDZh_ak;4.866666666666666
ChIJ7VWh6iqaP44RnEOtzI2OwOU;Los clientes destacan la calidad de la comida, describiéndola como deliciosa y casera, con un menú variado y saludable a precios muy asequibles, especialmente en el rango de $10,000 a $20,000. La atención del personal también recibe elogios constantes, siendo calificada como amable y eficiente. Además, muchos mencionan el ambiente agradable y familiar del lugar, lo que lo convierte en una opción ideal para disfrutar de un buen almuerzo o brunch.;Algunos comensales han reportado problemas de inconsistencia en la calidad de la comida, mencionando experiencias negativas como la aparición de un cabello en su plato. También hay comentarios sobre demoras en el servicio en momentos de alta demanda y una experiencia de atención deficiente en ocasiones. Es recomendable visitar en horarios menos concurridos para disfrutar de un servicio más ágil.;Club Suboficiales de la Policia Nacional;4.6281132;-74.07561539999999;https://www.google.com/maps/place/?q=place_id:ChIJ7VWh6iqaP44RnEOtzI2OwOU;4.8
ChIJ-zF95CqaP44Rwum11sAiZjo;Los clientes elogian la calidad de la comida, destacando especialmente la pasta y el lomo, que son considerados deliciosos y bien preparados. Muchos mencionan la atención al cliente como un punto fuerte, con un servicio amable y eficiente. El ambiente del restaurante también recibe comentarios positivos, describiéndolo como tranquilo y agradable, ideal para disfrutar de una buena comida. Además, los precios son considerados accesibles en relación a la calidad de los platillos.;Algunos comensales han tenido experiencias negativas con la consistencia de los platillos, mencionando que en ocasiones la pasta puede estar mal cocinada o sin sabor. También hay que tener en cuenta que el servicio puede ser lento en momentos de alta demanda, lo que ha llevado a que algunos clientes se sientan decepcionados. Por último, hay comentarios que sugieren que los precios han aumentado y que, en comparación, se pueden encontrar mejores opciones en otros lugares.;Andante Ma Non Troppo Restaurante;4.6290224;-74.07494439999999;https://www.google.com/maps/place/?q=place_id:ChIJ-zF95CqaP44Rwum11sAiZjo;4.866666666666666
